Title,Takeaway,Authors,Year,Citations,Abstract,Study Type,Journal,Journal SJR Quartile,DOI,Consensus Link
"Initiatives, Concepts, and Implementation Practices of FAIR (Findable, Accessible, Interoperable, and Reusable) Data Principles in Health Data Stewardship Practice: Protocol for a Scoping Review","FAIR data principles in health data stewardship can strengthen data sharing and research transparency, benefiting both evidence-based clinical practice and research transparency.","E. Inau, Jean Sack, Dagmar Waltemath, A. Zeleke",2020,33,"Background Data stewardship is an essential driver of research and clinical practice. Data collection, storage, access, sharing, and analytics are dependent on the proper and consistent use of data management principles among the investigators. Since 2016, the FAIR (findable, accessible, interoperable, and reusable) guiding principles for research data management have been resonating in scientific communities. Enabling data to be findable, accessible, interoperable, and reusable is currently believed to strengthen data sharing, reduce duplicated efforts, and move toward harmonization of data from heterogeneous unconnected data silos. FAIR initiatives and implementation trends are rising in different facets of scientific domains. It is important to understand the concepts and implementation practices of the FAIR data principles as applied to human health data by studying the flourishing initiatives and implementation lessons relevant to improved health research, particularly for data sharing during the coronavirus pandemic. Objective This paper aims to conduct a scoping review to identify concepts, approaches, implementation experiences, and lessons learned in FAIR initiatives in the health data domain. Methods The Arksey and O’Malley stage-based methodological framework for scoping reviews will be used for this review. PubMed, Web of Science, and Google Scholar will be searched to access relevant primary and grey publications. Articles written in English and published from 2014 onwards with FAIR principle concepts or practices in the health domain will be included. Duplication among the 3 data sources will be removed using a reference management software. The articles will then be exported to a systematic review management software. At least two independent authors will review the eligibility of each article based on defined inclusion and exclusion criteria. A pretested charting tool will be used to extract relevant information from the full-text papers. Qualitative thematic synthesis analysis methods will be employed by coding and developing themes. Themes will be derived from the research questions and contents in the included papers. Results The results will be reported using the PRISMA-ScR (Preferred Reporting Items for Systematic Reviews and Meta-analyses Extension for Scoping Reviews) reporting guidelines. We anticipate finalizing the manuscript for this work in 2021. Conclusions We believe comprehensive information about the FAIR data principles, initiatives, implementation practices, and lessons learned in the FAIRification process in the health domain is paramount to supporting both evidence-based clinical practice and research transparency in the era of big data and open research publishing. International Registered Report Identifier (IRRID) PRR1-10.2196/22505","systematic review","JMIR Research Protocols","3","10.2196/22505","https://consensus.app/papers/initiatives-concepts-and-implementation-practices-of-waltemath-sack/b66b8f5ab1cd523e88d777701aef2065/"
"Initiatives, Concepts, and Implementation Practices of FAIR (Findable, Accessible, Interoperable, and Reusable) Data Principles in Health Data Stewardship Practice: Protocol for a Scoping Review (Preprint)","FAIR data principles in health data stewardship can strengthen data sharing, reduce duplicated efforts, and improve research transparency in the era of big data and open research publishing.","E. Inau, Jean Sack, Dagmar Waltemath, A. Zeleke",2020,0,"
 BACKGROUND
 Data stewardship is an essential driver of research and clinical practice. Data collection, storage, access, sharing, and analytics are dependent on the proper and consistent use of data management principles among the investigators. Since 2016, the FAIR (findable, accessible, interoperable, and reusable) guiding principles for research data management have been resonating in scientific communities. Enabling data to be findable, accessible, interoperable, and reusable is currently believed to strengthen data sharing, reduce duplicated efforts, and move toward harmonization of data from heterogeneous unconnected data silos. FAIR initiatives and implementation trends are rising in different facets of scientific domains. It is important to understand the concepts and implementation practices of the FAIR data principles as applied to human health data by studying the flourishing initiatives and implementation lessons relevant to improved health research, particularly for data sharing during the coronavirus pandemic.
 
 
 OBJECTIVE
 This paper aims to conduct a scoping review to identify concepts, approaches, implementation experiences, and lessons learned in FAIR initiatives in the health data domain.
 
 
 METHODS
 The Arksey and O’Malley stage-based methodological framework for scoping reviews will be used for this review. PubMed, Web of Science, and Google Scholar will be searched to access relevant primary and grey publications. Articles written in English and published from 2014 onwards with FAIR principle concepts or practices in the health domain will be included. Duplication among the 3 data sources will be removed using a reference management software. The articles will then be exported to a systematic review management software. At least two independent authors will review the eligibility of each article based on defined inclusion and exclusion criteria. A pretested charting tool will be used to extract relevant information from the full-text papers. Qualitative thematic synthesis analysis methods will be employed by coding and developing themes. Themes will be derived from the research questions and contents in the included papers.
 
 
 RESULTS
 The results will be reported using the PRISMA-ScR (Preferred Reporting Items for Systematic Reviews and Meta-analyses Extension for Scoping Reviews) reporting guidelines. We anticipate finalizing the manuscript for this work in 2021.
 
 
 CONCLUSIONS
 We believe comprehensive information about the FAIR data principles, initiatives, implementation practices, and lessons learned in the FAIRification process in the health domain is paramount to supporting both evidence-based clinical practice and research transparency in the era of big data and open research publishing.
 
 
 INTERNATIONAL REGISTERED REPORT
 PRR1-10.2196/22505
","systematic review","","","10.2196/preprints.22505","https://consensus.app/papers/initiatives-concepts-and-implementation-practices-of-inau-zeleke/7af556096d225a3484efb3381782fca5/"
"Exploring the Current Practices, Costs and Benefits of FAIR Implementation in Pharmaceutical Research and Development: A Qualitative Interview Study","FAIR implementation in pharmaceutical research and development can potentially improve data reusability and save costs, but implementation costs and cultural change remain barriers.","Ebtisam Alharbi, R. Skeva, N. Juty, C. Jay, C. Goble",2021,14,"The findable, accessible, interoperable, reusable (FAIR) principles for scientific data management and stewardship aim to facilitate data reuse at scale by both humans and machines. Research and development (R&D) in the pharmaceutical industry is becoming increasingly data driven, but managing its data assets according to FAIR principles remains costly and challenging. To date, little scientific evidence exists about how FAIR is currently implemented in practice, what its associated costs and benefits are, and how decisions are made about the retrospective FAIRification of data sets in pharmaceutical R&D. This paper reports the results of semi-structured interviews with 14 pharmaceutical professionals who participate in various stages of drug R&D in seven pharmaceutical businesses. Inductive thematic analysis identified three primary themes of the benefits and costs of FAIRification, and the elements that influence the decision-making process for FAIRifying legacy data sets. Participants collectively acknowledged the potential contribution of FAIRification to data reusability in diverse research domains and the subsequent potential for cost-savings. Implementation costs, however, were still considered a barrier by participants, with the need for considerable expenditure in terms of resources, and cultural change. How decisions were made about FAIRification was influenced by legal and ethical considerations, management commitment, and data prioritisation. The findings have significant implications for those in the pharmaceutical R&D industry who are engaged in driving FAIR implementation, and for external parties who seek to better understand existing practices and challenges.","non-rct observational study","Data Intelligence","1","10.1162/dint_a_00109","https://consensus.app/papers/exploring-the-current-practices-costs-and-benefits-of-fair-alharbi-jay/a130e312429252d1b3fe66653b8cd6d6/"
"FAIRness for HL7 FHIR: supporting interoperability of health datasets","The HL7 FAIRness for FHIR implementation guide provides guidance on assessing and delivering FAIR health datasets using the HL7 FHIR standard, advancing the FAIRness of health data sets for open science, research, and innovation.","C. Chronaki, Giorgio Cangioli, Alicia Martinez, P. Damme, Carlos Luis, Parra Calderon",2021,1,"The FAIR (Finable Accessible Interoperable Reusable) principles have been established as best practice in the generation of health datasets for open science, research, and innovation. The FAIR4Health project (fair4health.eu) aims to encourage FAIRification and reuse of research data generated by publicly funded research projects. The Research Data Alliance (RDA) research community organization aims at building the social and technical infrastructure to enable open sharing and re-use of data. FAIR4Health and the RDA FAIR data maturity model WG initiated the HL7 FAIRness for FHIR implementation guide (IG) project to provide guidance on how to assess the FAIRness of health data sets with the RDA FAIR Data Maturity Model and support delivery of FAIR health datasets using the HL7 FHIR standard. In this paper, we present how we applied the guidance of the HL7 FAIRness for FHIR IG on selected PhysioNet datasets and reflect on the experience gained by discussing the recommendations of the IG on how to use HL7 FHIR resources to advance the FAIRness of health data sets.","","","","","https://consensus.app/papers/fairness-for-hl7-fhir-supporting-interoperability-of-chronaki-damme/8b3007e487f758e89cf18c9f9d1b3c53/"
"Aligning restricted access data with FAIR: a systematic review","This systematic literature review identifies various methods for making restricted data FAIR, providing a comprehensive conceptual framework for future research on restricted access data.","Margherita Martorana, Tobias Kuhn, R. Siebes, J. V. Ossenbruggen",2022,8,"Understanding the complexity of restricted research data is vitally important in the current new era of Open Science. While the FAIR Guiding Principles have been introduced to help researchers to make data Findable, Accessible, Interoperable and Reusable, it is still unclear how the notions of FAIR and Openness can be applied in the context of restricted data. Many methods have been proposed in support of the implementation of the principles, but there is yet no consensus among the scientific community as to the suitable mechanisms of making restricted data FAIR. We present here a systematic literature review to identify the methods applied by scientists when researching restricted data in a FAIR-compliant manner in the context of the FAIR principles. Through the employment of a descriptive and iterative study design, we aim to answer the following three questions: (1) What methods have been proposed to apply the FAIR principles to restricted data?, (2) How can the relevant aspects of the methods proposed be categorized?, (3) What is the maturity of the methods proposed in applying the FAIR principles to restricted data?. After analysis of the 40 included publications, we noticed that the methods found, reflect the stages of the Data Life Cycle, and can be divided into the following Classes: Data Collection, Metadata Representation, Data Processing, Anonymization, Data Publication, Data Usage and Post Data Usage. We observed that a large number of publications used ‘Access Control‘ and ‘Usage and License Terms’ methods, while others such as ‘Embargo on Data Release’ and the use of ‘Synthetic Data’ were used in fewer instances. In conclusion, we are presenting the first extensive literature review on the methods applied to confidential data in the context of FAIR, providing a comprehensive conceptual framework for future research on restricted access data.","systematic review","PeerJ Computer Science","1","10.7717/peerj-cs.1038","https://consensus.app/papers/aligning-restricted-access-data-with-fair-a-systematic-ossenbruggen-kuhn/5781e599cb345c7dad337bcb87c65a0d/"
"Experiences from compiling a FAIR survey in the German Network University Medicine","A FAIR survey was conducted in the German Network University Medicine to identify positive examples of FAIR data stewardship and motivate other projects to follow similar paths.","Lea Michaelis, Rasim Atakan Poyraz, M. R. Muzoora, Kerstin Gierend, A. Bartschke, Dagmar Waltemath, S. Thun",2023,0,"The FAIR guiding principles for data stewardship are a set of recommendations for making research objects findable, accessible, interoperable and reusable. FAIR assessment tools implement measures for these principles and thus enable research networks to evaluate how good they comply with current standards in open and reproducible science. Based on questions from two different FAIR assessment tools, we built a tailor-made survey for the FAIR evaluation of projects within the German Network University Medicine (NUM). Established at the start of the Covid-19 pandemic outbreak, NUM addressed the need to collect and integrate Covid-19 data across German University Hospitals. Technical developments aimed to follow, among others, the FAIR principles. Interested in the actual status of FAIRness, we conducted an online survey in 2022 across German Network University Medicine projects. The goal was to identify positive examples of FAIR data in the German Network University Medicine thus to motivate other projects to take similar routes.","non-rct observational study","","","","https://consensus.app/papers/experiences-from-compiling-a-fair-survey-in-the-german-waltemath-poyraz/394590ac835a5429bf97559a34fd2c0a/"
"The concept of fairness in the GDPR: a linguistic and contextual interpretation","Fairness in the GDPR refers to a substantial balancing of interests between data controllers and data subjects, focusing on mitigating vulnerabilities through specific safeguards and measures.","Gianclaudio Malgieri",2020,51,"There is a growing attention on the notion of fairness in the GDPR in the European legal literature. However, the principle of fairness in the Data Protection framework is still ambiguous and uncertain, as computer science literature and interpretative guidelines reveal. This paper looks for a better understanding of the concept of fairness in the data protection field through two parallel methodological tools: linguistic comparison and contextual interpretation. In terms of linguistic comparison, the paper analyses all translations of the world ""fair"" in the GDPR in the EU official languages, as the CJEU suggests in CILFIT Case for the interpretation of the EU law. The analysis takes into account also the translation of the notion of fairness in other contiguous fields (e.g. at Article 8 of the EU Charter of fundamental rights or in the Consumer field, e.g. Unfair terms directive or Unfair commercial practice directive). In general, the notion of fairness is translated with several different nuances (in accordance or in discordance with the previous Data protection Directive and with Article 8 of the Charter) In some versions different words are used interchangeably (it is the case of French, Spanish and Portuguese texts), in other versions there seems to be a specific rationale for using different terms in different parts of the GDPR (it is the case of German and Greek version). The analysis reveals three mean semantic notions: correctness (Italian, Swedish, Romanian), loyalty (French, Spanish, Portuguese and the German version of ""Treu und Glaube"") and equitability (French, Spanish and Portuguese). Interestingly, these three notions have common roots in the Western legal history: the Roman law notion of ""bona fide"". Taking into account both the value of ""bona fide"" in the current European legal contexts and also a contextual interpretation of the role of fairness in the GDPR, the preliminary conclusions is that fairness refers to a substantial balancing of interests among data controllers and data subjects. The approach of fairness is effect-based: what is relevant is not the formal respect of procedures (in terms of transparency, lawfulness or accountability), but the substantial mitigation of unfair imbalances that create situations of ""vulnerability"". Building on these reflections, the paper analyses how the notion of fairness and imbalance are related to the idea of vulnerability, within and beyond the GDPR. In sum, the article suggests that the best interpretation of the fairness principles in the GDPR (taking into account both the notion of procedural fairness and of fair balancing) is the mitigation of data subjects' vulnerabilities through specific safeguards and measures.","","Proceedings of the 2020 Conference on Fairness, Accountability, and Transparency","","10.1145/3351095.3372868","https://consensus.app/papers/the-concept-of-fairness-in-the-gdpr-a-linguistic-and-malgieri/94bcf9693770562d9c31e1f5b55c30ac/"
"The Notion of 'Fair Processing' in Data Privacy Law","""Fair processing"" in data privacy law is evaluated under US and European law, with the debate on generality versus specificity influencing the proposed EU General Data Protection Regulation.","Winston Maxwell",2015,0,"This paper examines how the concept of ""fair processing"" is evaluated under US and European data protection law. The paper first examines the FTC's ""fairness"" test, which involves an explicit cost-benefit analysis, before focusing on Article 6 of the European Data Protection Directive and related case law on ""fair processing."" The paper then examines ""fair processing"" from the law and economics perspective, and from the perspective of whether general standards are superior to detailed rules. The paper links the debate on generality versus specificity of norms to the question of whether the proposed EU General Data Protection Regulation may be too detailed and prescriptive.","","European Public Law: EU eJournal","","","https://consensus.app/papers/the-notion-of-fair-processing-in-data-privacy-law-maxwell/c069855360a752338d57edb26d0265ff/"
"GO FAIR Brazil: A Challenge for Brazilian Data Science","Brazilian scientific communities are implementing FAIR principles in research data management practices, with GO FAIR Brazil-Health serving as a model for other fields like agriculture, nuclear energy, and digital humanities.","L. Sales, Patrícia Henning, Viviane Veiga, Maira Murrieta Costa, Luís Fernando Sayão, Luiz Olavo Bonino da Silva Santos, L. F. Pires",2020,16,"The FAIR principles, an acronym for Findable, Accessible, Interoperable and Reusable, are recognised worldwide as key elements for good practice in all data management processes. To understand how the Brazilian scientific community is adhering to these principles, this article reports Brazilian adherence to the GO FAIR initiative through the creation of the GO FAIR Brazil Office and the manner in which they create their implementation networks. To contextualise this understanding, we provide a brief presentation of open data policies in Brazilian research and government, and finally, we describe a model that has been adopted for the GO FAIR Brazil implementation networks. The Brazilian Institute of Information in Science and Technology is responsible for the GO FAIR Brazil Office, which operates in all fields of knowledge and supports thematic implementation networks. Today, GO FAIR Brazil-Health is the first active implementation network in operation, which works in all health domains, serving as a model for other fields like agriculture, nuclear energy, and digital humanities, which are in the process of adherence negotiation. This report demonstrates the strong interest and effort from the Brazilian scientific communities in implementing the FAIR principles in their research data management practices.","","Data Intelligence","1","10.1162/dint_a_00046","https://consensus.app/papers/go-fair-brazil-a-challenge-for-brazilian-data-science-veiga-santos/5627b3baa0eb55e8bc9e765ed1d8377f/"
"FAIR for AI: An interdisciplinary and international community building perspective","FAIR principles are being adapted for AI models and datasets, aiming to enable reusability and promote interdisciplinary research.","E. Huerta, B. Blaiszik, L. Brinson, Kristofer E Bouchard, Daniel Diaz, C. Doglioni, Javier M. Duarte, M. Emani, Ian T Foster, Geoffrey Fox, P. Harris, Lukas Heinrich, S. Jha, Daniel S. Katz, V. Kindratenko, Christine R. Kirkpatrick, K. Lassila-Perini, R. Madduri, M. Neubauer, F. Psomopoulos, Avik Roy, O. Rübel, Zhizhen Zhao, Ruike Zhu",2022,46,"","","Scientific Data","1","10.1038/s41597-023-02298-6","https://consensus.app/papers/fair-for-ai-an-interdisciplinary-and-international-foster-madduri/a1b0d2d2825a5237935be6127a98bf6d/"
"Characterizing a Framework for Assessment of the Use of FAIR Principles for Health Data in Digital Health Devices Regulation.","This paper presents a framework for assessing the implementation of FAIR principles in health datasets used in digital health device regulations, focusing on metadata quality, interoperability, and privacy.","C. Parra-Calderón, Giulia Finocchiaro, Saif Ul Islam, Stuart Harrison, Gregory Epiphaniou, Carsten Maple, Parisis Gallos",2025,0,"This paper presents a structured framework to assess the implementation of FAIR (Findable, Accessible, Interoperable, Reusable) principles in health datasets used in regulatory processes for digital health devices. With the FAIR Data Maturity Model from the Research Data Alliance (RDA) and the Pistoia Alliance's FAIR Maturity Matrix as foundational guides, this framework provides a scalable, adaptable approach for evaluating dataset readiness and compliance with regulatory requirements. By focusing on metadata quality, interoperability, and privacy, this study supports regulatory bodies and developers in aligning with FAIR principles, enhancing transparency, and ensuring that data meets the standards necessary for digital health device approval.","","Studies in health technology and informatics","3","10.3233/SHTI250093","https://consensus.app/papers/characterizing-a-framework-for-assessment-of-the-use-of-epiphaniou-harrison/ad1326a868f65c5f97384242f2cf729f/"
"FAIR Data Austria – Paving the Way for Enhanced Research Data Management and Collaboration","The FAIR Data Austria project promotes research data sharing and collaboration by addressing technical and cultural barriers, promoting capacity building, community engagement, and developing tools and infrastructure.","Alexander Bardel, Ilire Hasani-Mavriqi",2023,1,"In an age dominated by digital information, the importance of accessible and well-managed research data cannot be overstated. The FAIR Data Austria project is at the forefront of pioneering initiatives that cultivate a culture of data sharing and collaboration, adhering to the principles of Findability, Accessibility, Interoperability and Reusability (FAIR). The project addresses the challenges associated with implementing FAIR principles – from technical complexity to cultural barriers – and takes a multi-faceted approach that includes capacity building initiatives, community engagement and the development of tools and infrastructure to facilitate FAIR research practices.","","Zeitschrift für Hochschulentwicklung","","10.21240/zfhe/sh-f/04","https://consensus.app/papers/fair-data-austria-%E2%80%93-paving-the-way-for-enhanced-research-bardel-hasani-mavriqi/940c575a04485076b7135e68b17153f7/"
