Title,Takeaway,Authors,Year,Citations,Abstract,Study Type,Journal,Journal SJR Quartile,DOI,Consensus Link
"Data Provenance Standards and Recommendations for FAIR Data","This paper suggests six provenance properties for data models to support FAIR principles, ensuring findable, accessible, interoperable, and reusable data for research and health.","M. Jauer, T. Deserno",2020,7,"This article reviews the main characteristics of five widely used data provenance models and recommendations. We suggest a set of six provenance properties that should be satisfied by any provenance model as a basis for further implementation of provenance mechanisms, supporting the findable, accessible, interoperable and reusable (FAIR) principles for both, research and health data.","literature review","Studies in health technology and informatics","3","10.3233/SHTI200380","https://consensus.app/papers/data-provenance-standards-and-recommendations-for-fair-jauer-deserno/1cf6daa7199a54f987eaed5a0b9368e8/"
"FAIR Enabling Re-Use of Data-Intensive Workflows and Scientific Reproducibility","FAIR principles can enhance the reproducibility of performance and scientific results in data-intensive workflows, but face challenges in high performance computing and data-intensive communities.","Line C. Pouchard",2023,0,"Scientific computing communities often run their experiments using complex data- and compute-intensive workflows that utilize high performance computing (HPC), distributed clusters and specialized architectures targeting machine learning and artificial intelligence. FAIR principles for data and software can be useful enablers for the reproducibility of performance (a key HPC metric) and that of scientific results (a crucial tenet of the scientific method) that are based in part on re-use, the R of FAIR principles. FAIR principles are under-used by HPC and data-intensive communities who have been slow to adopt them. This is due in part to the complexity of workflow life cycles, the numerous workflow management systems, the lack of integration of FAIR within existing technologies, and the specificity of managed systems that include rapidly evolving architectures and software stacks, and execution models that require resource managers and batch schedulers. Numerous challenges emerge for scientists attempting to publish FAIR datasets and software for the purpose of re-use and reproducibility, e.g. what data to publish and where due to sizes, how to ""FAIRify"" data subsetting, at what level of granularity to attribute persistent identifiers to software, what is the minimal amount of metadata needed to guarantee a certain level of reproducibility, what does reproducible AI actually mean? This talk will focus on such challenges and illustrate the negative impact of not applying FAIR on the reproducibility of experiments. We will introduce the notion of FAIR Digital Objects and present RECUP, a framework for data and metadata services for high performance workflows that proposes micro-solutions for adapting FAIR principles to HPC.","","Companion of the 2023 ACM/SPEC International Conference on Performance Engineering","","10.1145/3578245.3586012","https://consensus.app/papers/fair-enabling-reuse-of-dataintensive-workflows-and-pouchard/20a7e08bca0a58d097567f6ac4da1711/"
"FAIR Enough: Develop and Assess a FAIR-Compliant Dataset for Large Language Model Training?","This study proposes a novel framework to integrate FAIR principles into Large Language Model training data, promoting ethical data stewardship and responsible AI model development.","Shaina Raza, Shardul Ghuge, Chen Ding, Elham Dolatabadi, D. Pandya",2024,9,"ABSTRACT The rapid evolution of Large Language Models (LLMs) highlights the necessity for ethical considerations and data integrity in AI development, particularly emphasizing the role of FAIR (Findable, Accessible, Interoperable, Reusable) data principles. While these principles are crucial for ethical data stewardship, their specific application in the context of LLM training data remains an under-explored area. This research gap is the focus of our study, which begins with an examination of existing literature to underline the importance of FAIR principles in managing data for LLM training. Building upon this, we propose a novel frame-work designed to integrate FAIR principles into the LLM development lifecycle. A contribution of our work is the development of a comprehensive checklist intended to guide researchers and developers in applying FAIR data principles consistently across the model development process. The utility and effectiveness of our frame-work are validated through a case study on creating a FAIR-compliant dataset aimed at detecting and mitigating biases in LLMs. We present this framework to the community as a tool to foster the creation of technologically advanced, ethically grounded, and socially responsible AI models.","","Data Intelligence","1","10.1162/dint_a_00255","https://consensus.app/papers/fair-enough-develop-and-assess-a-faircompliant-dataset-for-raza-ding/7dd1aa2d951a5acdb7084bcb9c21f1e3/"
"FAIRness in Dataspaces: The Role of Semantics for Data Management","Semantics can ensure data FAIRness in dataspaces, enabling machine-aided discovery and reuse of data in different formats and structures.","Marco Hauff, Lina Molinas Comet, Paul Moosmann, Christoph Lange, Ioannis Chrysakis, Johannes Theissen-Lipp",2024,4,"Effective data governance and management are necessary but challenging prerequisites for creating value from data assets. Findability, accessibility, interoperability, and reusability are guiding principles for data owners in managing and archiving datasets, known as the FAIR Principles. Dataspaces provide an infrastructure for heterogeneous, multi-source data integration and cross-organizational data sharing that would benefit from FAIR compliance. In this paper, we propose semantics as an approach to ensure data FAIRness, enabling machine-aided discovery and reuse of data in different formats and structures. We conduct a systematic literature review to translate the overarching principles into ten concrete methods that can be implemented using semantic technologies. In addition, we analyze three mature dataspace initiatives for their adherence to the FAIR Principles and describe their specific implementation. In summary, we argue that semantics provide a common and infrastructure-independent foundation for data management in emerging dataspaces.","systematic review","","","","https://consensus.app/papers/fairness-in-dataspaces-the-role-of-semantics-for-data-lange-hauff/bbffd5cfacbf5069a0ea22c3846fdeb4/"
"Initiatives, Concepts, and Implementation Practices of FAIR (Findable, Accessible, Interoperable, and Reusable) Data Principles in Health Data Stewardship Practice: Protocol for a Scoping Review","FAIR data principles in health data stewardship can strengthen data sharing and research transparency, benefiting both evidence-based clinical practice and research transparency.","E. Inau, Jean Sack, Dagmar Waltemath, A. Zeleke",2020,33,"Background Data stewardship is an essential driver of research and clinical practice. Data collection, storage, access, sharing, and analytics are dependent on the proper and consistent use of data management principles among the investigators. Since 2016, the FAIR (findable, accessible, interoperable, and reusable) guiding principles for research data management have been resonating in scientific communities. Enabling data to be findable, accessible, interoperable, and reusable is currently believed to strengthen data sharing, reduce duplicated efforts, and move toward harmonization of data from heterogeneous unconnected data silos. FAIR initiatives and implementation trends are rising in different facets of scientific domains. It is important to understand the concepts and implementation practices of the FAIR data principles as applied to human health data by studying the flourishing initiatives and implementation lessons relevant to improved health research, particularly for data sharing during the coronavirus pandemic. Objective This paper aims to conduct a scoping review to identify concepts, approaches, implementation experiences, and lessons learned in FAIR initiatives in the health data domain. Methods The Arksey and O’Malley stage-based methodological framework for scoping reviews will be used for this review. PubMed, Web of Science, and Google Scholar will be searched to access relevant primary and grey publications. Articles written in English and published from 2014 onwards with FAIR principle concepts or practices in the health domain will be included. Duplication among the 3 data sources will be removed using a reference management software. The articles will then be exported to a systematic review management software. At least two independent authors will review the eligibility of each article based on defined inclusion and exclusion criteria. A pretested charting tool will be used to extract relevant information from the full-text papers. Qualitative thematic synthesis analysis methods will be employed by coding and developing themes. Themes will be derived from the research questions and contents in the included papers. Results The results will be reported using the PRISMA-ScR (Preferred Reporting Items for Systematic Reviews and Meta-analyses Extension for Scoping Reviews) reporting guidelines. We anticipate finalizing the manuscript for this work in 2021. Conclusions We believe comprehensive information about the FAIR data principles, initiatives, implementation practices, and lessons learned in the FAIRification process in the health domain is paramount to supporting both evidence-based clinical practice and research transparency in the era of big data and open research publishing. International Registered Report Identifier (IRRID) PRR1-10.2196/22505","systematic review","JMIR Research Protocols","3","10.2196/22505","https://consensus.app/papers/initiatives-concepts-and-implementation-practices-of-waltemath-sack/b66b8f5ab1cd523e88d777701aef2065/"
"Going beyond FAIR to increase data reliability","Introducing data reliability, uncertainty, quality, and device information in the data workflow from sensor to database can enhance data reliability and reduce false scientific conclusions.","U. Koedel, P. Dietrich",2020,0,"
 <p>The FAIR principle is on its way to becoming a conventional standard for all kinds of data. However, it is often forgotten that this principle does not consider data quality or data reliability issues. If the data quality isis not sufficiently described, a wrong interpretation and use of these data in a common interpretation can lead to false scientific conclusions. Hence, the statement about data reliability is an essential component for secondary data processing and joint interpretation efforts. Information on data reliability, uncertainty, quality as well as information on the used devices are essential and needs to be introduced or even implemented in the workflow from the sensor to a database if data is to be considered in a broader context.</p><p>In the past, many publications have shown that the same devices at the same location do not necessarily provide the same measurement data. Likewise, statistical quantities and confidence intervals are rarely given in publications in order to assess the reliability of the data. Many secondary users of measurement data assume that calibration data and the measurement of other auxiliary variables are sufficient to estimate the data reliability. However, even if some devices require on-site field calibration, that does not mean that the data are comparable. Heat, cold, internal processes on electronic components can lead to differences in measurement data recorded with devices of the same type at the same location, especially with the increasingly complex devices themselves.</p><p>The data reliability can be increased by implementing data uncertainty issues within the FAIR principle. The poster presentation will show the importance of comparative measurements, the information needs for the application of proxy-transfer functions, and suitable uncertainty analysis for databases.</p>
","","","","10.5194/egusphere-egu2020-11117","https://consensus.app/papers/going-beyond-fair-to-increase-data-reliability-dietrich-koedel/924eddadaad054758a02f2592db56efd/"
"Towards FAIR protocols and workflows: the OpenPREDICT use case","Our two-fold approach, applying FAIR principles to scientific workflows and datasets, significantly enhances the discoverability and reusability of research data.","R. Çelebi, J. Moreira, Ahmed A. Hassan, Sandeep Ayyar, Lars Ridder, Tobias Kuhn, M. Dumontier",2020,16,"It is essential for the advancement of science that researchers share, reuse and reproduce each other’s workflows and protocols. The FAIR principles are a set of guidelines that aim to maximize the value and usefulness of research data, and emphasize the importance of making digital objects findable and reusable by others. The question of how to apply these principles not just to data but also to the workflows and protocols that consume and produce them is still under debate and poses a number of challenges. In this paper we describe a two-fold approach of simultaneously applying the FAIR principles to scientific workflows as well as the involved data. We apply and evaluate our approach on the case of the PREDICT workflow, a highly cited drug repurposing workflow. This includes FAIRification of the involved datasets, as well as applying semantic technologies to represent and store data about the detailed versions of the general protocol, of the concrete workflow instructions, and of their execution traces. We propose a semantic model to address these specific requirements and was evaluated by answering competency questions. This semantic model consists of classes and relations from a number of existing ontologies, including Workflow4ever, PROV, EDAM, and BPMN. This allowed us then to formulate and answer new kinds of competency questions. Our evaluation shows the high degree to which our FAIRified OpenPREDICT workflow now adheres to the FAIR principles and the practicality and usefulness of being able to answer our new competency questions.","","PeerJ Computer Science","1","10.7717/peerj-cs.281","https://consensus.app/papers/towards-fair-protocols-and-workflows-the-openpredict-use-dumontier-moreira/954e77bf70565be489cff10b0db35385/"
"Automating the Evaluation of Datasets for FAIR and CARE Principles","Automating evaluation of datasets for FAIR and CARE principles simplifies open data organization, promoting greater open science expansion.","Rujula Yete, Shweta Purawat, Ismael Pérez, Daniel Crawl, I. Altintas",2023,0,"The FAIR and CARE data principles are critical to ensuring widespread and equitable access to open data. They provide guidelines for what should be contained in metadata and how certain types of data should be handled. This study examines how large, collective data hubs such as the WIFIRE Data Commons can implement the FAIR and CARE data principles through evaluating the datasets hosted on the platform. An automation pipeline was developed to check for specified criteria in these principles, allowing fast integration of the principles on a large scale data hub. This pipeline can be expanded to check for all FAIR and CARE criteria, and similar pipelines can be created for a variety of other data hubs. Automating for the FAIR and CARE principles will help simplify organization of open data, allowing for a greater expansion of open science.","","2023 IEEE 19th International Conference on e-Science (e-Science)","","10.1109/e-Science58273.2023.10254897","https://consensus.app/papers/automating-the-evaluation-of-datasets-for-fair-and-care-yete-crawl/91d8d8e03ee45a3ca8dc765758f7b6e8/"
"FAIRness in Biomedical Data Discovery","Biomedical data discovery platforms that adopt FAIR principles show promise in improving data quality and reusability, but more work is needed to assess their impact on interoperability and secondary reuse.","A. Trifan, J. Oliveira",2019,3,"The FAIR Guiding Principles are a recent, yet powerful set of recommendations for turning data Findable, Accessible, Interoperable and Reusable. They were designed with the purpose of improving data quality and reusability. Over the last couple of years they have been adopted more and more by both data owners and funders as key data management approaches. Despite their increasing popularity and endorsement by multiple research initiatives from some of the most diverse areas, there are still only a few examples on how these principles have been translated into practice. In this work we propose an open evaluation of their adoption by biomedical data discovery platforms. We first overview current biomedical data discovery platforms that introduce the FAIR guiding principles as requirements of their functioning. We then employ the more recent FAIR metrics for evaluating the degree to which these biomedical data discovery platforms follow the FAIR principles. Moreover, we assess their impact on enabling data interoperability and secondary reuse.","","","","10.5220/0007576401590166","https://consensus.app/papers/fairness-in-biomedical-data-discovery-trifan-oliveira/2b9f711a82ff5ebfaf7f74af97d75468/"
"More than an apple a day: A survey study on the state of the practice of health information systems among Dutch practitioners","FAIR principles are mainly adopted in genetics research, but less frequently in other subdomains, impacting progress in science and care for people with ID.","H. Tobi, J. Tummers, C. Catal, B. Schalk, G. Leusink, B. Tekinerdogan",2019,1,"Introduction: FAIR is the acronym of the four data‐principles Findable, Accessible, Interoperable and Re‐usable. These principles have been developed to enhance optimal use of research data and are also considered to reflect the usefulness of big data for research. What is the impact of FAIR principles in research on people with ID? What are possible gains and losses of not/using these principles? Methods: A systematic review of the literature was done to investigate the use of the FAIR principles in research on people with ID. A deductive coding scheme was applied and keywords given in bibliographic data bases were used to compare subdomains. Possible reasons for patterns found will be explored by means of a critical narrative review. Results: The FAIR principles appear to be mainly adopted by researchers in genetics. Despite a more general call for sharing data, this appears to happen less frequently in other subdomains. Implications: The (lack of) adoption of FAIR principles has consequences for the direction and (amount of) progress made in science and care for people with ID. Identified reasons for (not) adopting the FAIR principles need further discussion and creative problem solving.","systematic review","Journal of Intellectual Disability Research","1","","https://consensus.app/papers/more-than-an-apple-a-day-a-survey-study-on-the-state-of-the-tekinerdogan-tummers/b47440d6d2ed5ccf947e26c1d1ac5de6/"
"FAIR data management: a framework for fostering data literacy in biomedical sciences education","Integrating FAIR principles into biomedical sciences education enhances research reproducibility and transparency, equipping future researchers with essential skills for navigating a data-driven scientific environment.","Rocio Gonzalez Soltero, Debora Pino García, Alberto Bellido, Pablo Ryan, Ana I. Rodríguez-Learte",2024,0,"Data literacy, the ability to understand and effectively communicate with data, is crucial for researchers to interpret and validate data. However, low reproducibility in biomedical research is nowadays a significant issue, with major implications for scientific progress and the reliability of findings. Recognizing this, funding bodies such as the European Commission emphasize the importance of regular data management practices to enhance reproducibility. Establishing a standardized framework for statistical methods and data analysis is essential to minimize biases and inaccuracies. The FAIR principles (Findable, Accessible, Interoperable, Reusable) aim to enhance data interoperability and reusability, promoting transparent and ethical data practices. The study presented here aimed to train postgraduate students at the Universidad Europea de Madrid in data literacy skills and FAIR principles, assessing their application in master thesis projects. A total of 46 participants, including students and mentors, were involved in the study during the 2022–2023 academic year. Students were trained to prioritize FAIR data sources and implement Data Management Plans (DMPs) during their master's thesis. An 11-item questionnaire was developed to evaluate the FAIRness of research data, showing strong internal consistency. The study found that integrating FAIR principles into educational curricula is crucial for enhancing research reproducibility and transparency. This approach equips future researchers with essential skills for navigating a data-driven scientific environment and contributes to advancing scientific knowledge.","non-rct observational study","BMC Medical Research Methodology","1","10.1186/s12874-024-02404-1","https://consensus.app/papers/fair-data-management-a-framework-for-fostering-data-soltero-ryan/404b16b128665e8eb46f0b037fd449ce/"
"The Fairness Principle in Personal Data Processing","The principle of fairness in personal data processing under the General Data Protection Regulation (GDPR) 2016/679/EU has new meanings and implications in dispute resolution and practical workings of controllers.","D. Şandru",2019,1,"The principle of fairness in processing personal data, kept from the previous regulation, is liable to gain new meanings following the burden placed on the operator to prove its observance. The study aims at outlining the meaning and content of the principle of equity and its role in dispute resolution as well as in the practical workings of the controller, according to the General Data Protection Regulation (GDPR) 2016/679/EU.","","SSRN Electronic Journal","","10.2139/ssrn.3641883","https://consensus.app/papers/the-fairness-principle-in-personal-data-processing-%C5%9Fandru/1aae30e9034659d3ab78bf5b92849538/"
"Testing the FAIR metrics on data catalogs","CKAN performs best in making data FAIR, with potential for further improvements through FAIR metadata creation and data stewardship.","Jarno A. A. van Erp, C. Langen, Anca Boon, K. V. Bochove",2018,3,"The introduction of the FAIR –Findable, Accessible, Interoperable, Reusable– principles has caused quite an uproar within the scientific community. Principles which, if everyone adheres to them, could result in new, revolutionary ways of performing research and fulfill the promise of open science. Furthermore, it allows for concepts such as personalized medicine and personal health monitoring to -finally- become implemented in daily practice.
 However, to bring about these changes, data users need to rethink the way they treat scientific data. Just passing a dataset along, without extensive metadata will not suffice anymore. Such new ways of executing research require a significantly different approach from the entire scientific community or, for that matter, anyone who wants to reap the benefits from going FAIR.
 Yet, how do you initiate behavioral change? One important solution is by changing the software scientists use and requiring data owners, or data stewards, to FAIRify their dataset. Data catalogs are a great starting point for FAIRifying data as the software already intends to make data Findable and Accessible, while the metadata is Interoperable and relying on users to provide sufficient metadata to ensure Reusability. In this paper we analyse how well the FAIR principles are implemented in several data catalogs.
 To determine how FAIR a catalog is, the FAIR metrics were created by the GO-FAIR initiative. These metrics help determine to what extend data can be considered FAIR. However, the metrics were only recently developed, being first released at the end of 2017. At the moment software does not come standard with a FAIR metrics review. Still, this insight is highly desired by the scientific community. How else can they be sure that (public) money is spend in a FAIR way?
 The Hyve has tested/evaluated three popular open source data catalogs based on the FAIR metrics: CKAN, Dataverse, and Invenio. Most data stewards will be familiar with at least one of these.
 Within this white paper we provide answers to the following questions:
 Which of the three data catalogs performs best in making data FAIR?
 Which data catalog utilizes FAIR datasets the most?
 Which one creates the most FAIR metadata?
 Which catalog has the highest potential to increase its FAIRness, and how?
 Which data catalog facilitates the FAIRifying process the best?","","PeerJ Prepr.","","10.7287/peerj.preprints.27151v2","https://consensus.app/papers/testing-the-fair-metrics-on-data-catalogs-langen-bochove/2c9f3875c15858948f0a278ca156f37d/"
