Title,Takeaway,Authors,Year,Citations,Abstract,Study Type,Journal,Journal SJR Quartile,DOI,Consensus Link
"Towards FAIR Data Access","Machine-actionable data access is crucial for research applications, and technologies like signposting and digital object gateways can help achieve this goal.","D. Broeder, W. Elbers, Michal Gawor, C. Concordia, Nicolas Larrousse, Dieter Van Uytvanck",2022,1,"
 Background 
 
 In the past decade many different national, EU and global projects have been successful in raising awareness about Open Science and the importance of making data findable and accessible such as stated in the FAIR principles (Wilkinson et al. 2016).
 In this respect, there have been many advances with respect to options for discovering data. A multitude of either thematic or general catalogues are providing faceted browsing interfaces for humans and Application Programming Interfaces (APIs) for use by machines and similarly, data-citations in publications offer references to resources hosted by repositories. However, using such catalogues and data-citations, researchers are not guaranteed to obtain access to the data itself. Mostly the resource link in the catalogue (and also in the metadata) or citation is a “landing-page”, a description of the resource meant for human consumption. The landing-page may contain instructions how to access or download the resource itself but usually it is difficult to parse by machines.
 
 FAIR data access
 
 Thus the approach sketched above does not meet the requirements in scenarios where applications need assured and quick access to data. Also the FAIR principles interpretation from GO FAIR states*1 that these “emphasise machine-actionability (i.e., the capacity of computational systems to find, access, interoperate, and reuse data with none or minimal human intervention) because humans increasingly rely on computational support to deal with data as a result of the increase in volume, complexity, and creation speed of data.” The requirement for providing a Persistent Identifier (PID) for a resource*2, is mostly interpreted as meaning a PID for the resource’s metadata or landing-page only. 
 Note that we ignore the need for user authentication and authorization prior to accessing data, here we will only consider data that is ‘freely’ accessible.
 To improve the situation with respect to machine data accessibility a number of technologies and approaches that have been discussed in the CLARIN and Social Sciences and Humanities (SSH) infrastructure domain can be useful. We present some and comment on their suitability.
 
 Signposting
 
 Signposting*3 is a technology proposed by van de Sompel (Sompel and Nelson 2015) to release relevant technical and bibliographical attributes from a resource URI. It's well described, and uses the HTTP protocol to provide additional information via HTTP Link Headers*4. Alternatively, for HTML type resources, the information may also be provided in HTML Link elements. 
 In the CLARIN community the signposting concept was accepted, but its proposed implementation deviated from van de Sompel and made it less dependent on the HTTP protocol (Arnold et al. 2021). However on the downside, the signposting information is embedded in the CLARIN specific Component Metadata (CMDI) (Broeder et al. 2012), and so makes it CLARIN specific, or at least requires clients to have specific knowledge about CMDI.
 
 CLARIN Digital Object Gateway (DOG)
 
 
 One approach that is currently worked on for the CLARIN research infrastructure is the creation of a DOG library*5 and (later) a service that provides a proxy gateway from the resource PID to the actual data. DOG uses implicit knowledge about the different repository solutions that are used by the CLARIN B-type centres*6 and some repositories outside the CLARIN infrastructure. 
 
 DOG works in two steps: first obtaining metadata from the resource PID and secondly extracting resource links from the metadata. Each of the repositories registered within DOG has a minimal configuration specifying how to parse fields of interest from the resource's metadata. For B-type CLARIN centres DOG uses content negotiation as the primary way of obtaining the metadata in CMDI format. For repositories outside the CLARIN infrastructure, DOG primarily relies on the API provided by the repository in order to access metadata and data resources. 
 
 The DOG solution does have scalability problems, but within the limited domain of CLARIN centres, it can offer a solution until a better one becomes available.
 
 
 Limited PID kernel information
 
 
 The (limited) PID kernel information approach assumes that for every Digital Object (DO) (Berg-Cross et al. 2015) and its metadata a Handle type PID (CNRI 2020) is issued and that the Handle information record can be used to store and associate additional important information with the (meta) data PID using handle value types such as for example a checksum and references to the data or metadata. This is a simplification of the architecture proposed in the work done in RDA context: PID Kernel Info recommendations (Weigel et al. 2018). Consistent use of Handle information records could solve the data access problem, but just as for the signposting strategy, it requires strong discipline to maintain the additional information source. Examples from smaller projects and repositories exist that do manage this information in the Handle record eg. the DARIAH-DE repository*7. 
 
 
 FAIR Digital Objects (FDO)
 
 
 FDOs*8 attempt to overcome the data management challenges posed by the heterogeneity and complexity of data using a combination of abstraction, virtualization and encapsulation (Schwardmann 2020). In practice, in the context of our access to data problem, the FDO solution can be seen as both a generalization and upgrade of the PID kernel information approach. The key characteristics here are the (conceptual) encapsulation of data objects with data structure and services that allow aware applications to recognize the data objects metadata and bitstream format, and process as intended by the programmer. Eligible data processing services, either general ones from communities, can be found through the FDO typing mechanism, or can be directly linked from the FDO.
 
 
 A rich set of FDO attributes permit signaling machines processing FDOs where and how to access bitstream data including for instance additional information about supported protocols and APIs.
 
 
 What to do?
 
 
 For our community and in our collaboration with others, we need solutions now but would prefer not to invest and get closed in unscalable technologies.
 
 We would propose to combine the DOG approach with signposting. First testing URIs (obtained by resolving the Handle PID) for the presence of HTTP Link Headers. If these are missing, (extended) DOG could use its idiosyncratic workflow. Long term we see advantages of the general, scalable and protocol independent approach that FDOs offer. Hybrid solutions are conceivable where FDO proxies can sit between the FDO machinery and data hosted by signposting compliant repositories.","","Research Ideas and Outcomes","","10.3897/rio.8.e94386","https://consensus.app/papers/towards-fair-data-access-larrousse-uytvanck/512de79332795f478ea2f46032976561/"
"FAIR Begins at home: Implementing FAIR via the Community Data Driven Insights","Implementing FAIR principles in research requires transforming university culture, educating scientists, and providing financial and technical tools to facilitate the transition across disciplines.","Carlos Utrilla Guerrero, Maria Vivas Romero",2022,3,"Arguments for the FAIR (Findable, Accesible, Inter-operable and Reusable) principles of science have mostly been based on appeals to values. However, the work of onboarding diverse researchers to make efficient and effective implementations of FAIR requires different appeals. In our recent effort to transform the institution into a FAIR University by 2025, here we report on the experiences of the Community of Data Driven Insights (CDDI), a interfaculty initiative where all university-wide research data service providers are joined together to support researchers and research groups (e.g. see research showcase example here) with all aspects concerning research data management. CDDI aims to turn all digital objects within Maastricht University (UM) into FAIR Digital Objects (FDO) and by disclosing the progress and challenges of implementing FDOs (e.g. see CDDI OSF repo: https://osf.io/398cz/), we hope to shed light on the process in a way that might be useful for other institutions in Europe and elsewhere. We initially identified 5 challenges for FDO implementation. These challenges were first a matter of reshaping the culture of science making practices to fit the FAIR principles. Additionally, it required an educational awareness within the scientific communities, and finally financial and technical tools to actually facilitate the transition to FAIR practices of science making. These perspectives show the complex dimensions of FAIR principles and FDO implementation to researchers across disciplines in a single university.","","Research Ideas and Outcomes","","10.3897/rio.8.e96082","https://consensus.app/papers/fair-begins-at-home-implementing-fair-via-the-community-romero-guerrero/a12a1fe5ccc0572b9dd08445f8d5f278/"
"COVID-19-related research data availability and quality according to the FAIR principles: A meta-research study","COVID-19-related research data shows potential for improvement in FAIR principles, with repository being the most influential factor on data accessibility and reusability.","A. Sofi-Mahmudi, E. Raittio, Yeganeh Khazaei, Javed Ashraf, F. Schwendicke, S. Uribe, D. Moher",2023,0,"Background As per the FAIR principles (Findable, Accessible, Interoperable, and Reusable), scientific research data should be findable, accessible, interoperable, and reusable. The COVID-19 pandemic has led to massive research activities and an unprecedented number of topical publications in a short time. There has not been any evaluation to assess if this COVID-19-related research data complied with FAIR principles (or FAIRness) so far. Objective Our objective was to investigate the availability of open data in COVID-19-related research and to assess compliance with FAIRness. Methods We conducted a comprehensive search and retrieved all open-access articles related to COVID-19 from journals indexed in PubMed, available in the Europe PubMed Central database, published from January 2020 through June 2023, using the metareadr package. Using rtransparent, a validated automated tool, we identified articles that included a link to their raw data hosted in a public repository. We then screened the link and included those repositories which included data specifically for their pertaining paper. Subsequently, we automatically assessed the adherence of the repositories to the FAIR principles using FAIRsFAIR Research Data Object Assessment Service (F-UJI) and rfuji package. The FAIR scores ranged from 1–22 and had four components. We reported descriptive analysis for each article type, journal category and repository. We used linear regression models to find the most influential factors on the FAIRness of data. Results 5,700 URLs were included in the final analysis, sharing their data in a general-purpose repository. The mean (standard deviation, SD) level of compliance with FAIR metrics was 9.4 (4.88). The percentages of moderate or advanced compliance were as follows: Findability: 100.0%, Accessibility: 21.5%, Interoperability: 46.7%, and Reusability: 61.3%. The overall and component-wise monthly trends were consistent over the follow-up. Reviews (9.80, SD=5.06, n=160), and articles in dental journals (13.67, SD=3.51, n=3) and Harvard Dataverse (15.79, SD=3.65, n=244) had the highest mean FAIRness scores, whereas letters (7.83, SD=4.30, n=55), articles in neuroscience journals (8.16, SD=3.73, n=63), and those deposited in GitHub (4.50, SD=0.13, n=2,152) showed the lowest scores. Regression models showed that the most influential factor on FAIRness scores was the repository (R2=0.809). Conclusion This paper underscored the potential for improvement across all facets of FAIR principles, with a specific emphasis on enhancing Interoperability and Reusability in the data shared within general repositories during the COVID-19 pandemic.","meta-analysis","PLOS ONE","1","10.1371/journal.pone.0313991","https://consensus.app/papers/covid19related-research-data-availability-and-quality-schwendicke-uribe/49471b2c029a5e15bb79a56795940a62/"
"GO-Plan: A goal-oriented method for FAIRification planning","GO-Plan is a goal-oriented method for identifying and refining FAIRification objectives, enabling stakeholders to communicate effectively and make informed implementation decisions.","C. Bernabé, Isadora Valle, Tiago Prince Sales, E. Schultes, Niek van Ulzen, Vítor E Silva Souza, Annika Jacobsen, Luiz Olavo Bonino da Silva Santos, B. Mons, M. Roos",2025,0,"The FAIR principles provide guidance on improving the Findability, Accessibility, Interoperability, and Reusability of digital resources. Since the publication of the principles, several workflows have been proposed to support the process of making data FAIR (FAIRification). However, to respect the uniqueness of different communities, both the principles and the available workflows have been deliberately designed to remain agnostic in terms of standards, tools, and implementation choices. Consequently, FAIRification needs to be properly planned, and implementation details must be discussed with stakeholders and aligned with FAIRification objectives. To support this need, this paper describes GO-Plan, a method for identifying and refining FAIRification objectives. Leveraging on best practices from requirements and ontology engineering, the method aims at incrementally elaborating the most obvious aspects of the domain (e.g. the initial set of elements to be collected) into complex and comprehensive objectives. The definition of clear objectives enables stakeholders to communicate effectively and make informed implementation decisions, such as defining achievement criteria for distinct principles and identifying relevant metadata to be collected. GO-Plan has been validated in multiple discussion sessions with experts on FAIR, in an application to a real use case and in two hands-on tutorials with end-users.","","Information Services and Use","3","10.1177/18758789251324008","https://consensus.app/papers/goplan-a-goaloriented-method-for-fairification-planning-jacobsen-valle/2c75b23293c35e0faf58ea2c1b26834c/"
"Talking about the fair principles of social market economy","Fair principles in social market economy focus on social material benefits, market main-body benefits, WTO rules, and developing a good market environment for fair competition.","Gao Bao",2003,0,"This article mainly tells the meaning of fairness and fair principles.It discusses the fair principles and social material benefit principles,market main-body benefit,the indentity of WTO rules and how to develop good market environment of fair competition.","","","","","https://consensus.app/papers/talking-about-the-fair-principles-of-social-market-economy-bao/eebd891f899a51cb8c9cc5f2b3640046/"
"FAIR standards for astronomical data","FAIR principles for astronomical data management are closely connected to IVOA standards, and implementing these standards can lead to near compliance.","S. O’Toole, J. Tocknell",2022,1,"We present an overview of the “FAIR Guiding Principles for scientific data management and stewardship”, first published in 2016, and how they relate to astronomical data management. In particular, we discuss the connection between the FAIR principles and IVOA standards, and how data management systems with these standards implemented are close to compliance. We then look at what extra components are required to make astronomical data FAIR. Finally, we give a case study of the All-Sky Virtual Observatory (Australia’s node of the VO) and their implementation of the FAIR principles.","","","","","https://consensus.app/papers/fair-standards-for-astronomical-data-o%E2%80%99toole-tocknell/12a1a5e9413c5552b48a77ccd9115892/"
"Status and challenges of FAIR data principles for a long-term repository","IRIS Data Services is well on its way to adherence to FAIR data principles, but challenges remain in persistent IDs, metadata updates, and data licensing.","C. Trabant, R. Benson, R. Casey, G. Sharer, Jerry Carter",2020,0,"
 <p>The data center of the National Science Foundation&#8217;s Seismological Facility for the Advancement of Geoscience (SAGE), operated by IRIS Data Services, has evolved over the past 30 years to address the data accessibility needs of the scientific research community.&#160; In recent years a broad call for adherence to FAIR data principles has prompted repositories to increased activity to support them. As these principles are well aligned with the needs of data users, many of the FAIR principles are already supported and actively promoted by IRIS.&#160; Standardized metadata and data identifiers support findability. Open and standardized web services enable a high degree of accessibility. Interoperability is ensured by offering data in a combination of rich, domain-specific formats in addition to simple, text-based formats. The use of open, rich (domain-specific) format standards enables a high degree of reuse.&#160; Further advancement towards these principles includes: an introduction and dissemination of DOIs for data; and an introduction of Linked Data support, via JSON-LD, allowing scientific data brokers, catalogers and generic search systems to discover data. Naturally, some challenges remain such as: the granularity and mechanisms needed for persistent IDs for data; the reality that metadata is updated with corrections (having implications for FAIR data principles); and the complexity of data licensing in a repository with data contributed from individual PIs, national observatories, and international collaborations.&#160; In summary, IRIS Data Services is well along the path of adherence of FAIR data principles with more work to do. We will present the current status of these efforts and describe the key challenges that remain.</p>
","","","","10.5194/egusphere-egu2020-13475","https://consensus.app/papers/status-and-challenges-of-fair-data-principles-for-a-trabant-casey/98efd4b2f6325617902622acbc383505/"
"Fairness, principle of","The principle of fairness in Rawls's theory of justice grounds an obligation to obey the law for a limited subset of citizens, evolving over time.","D. Lyons, J. Mandle, David A. Reidy",2014,0,"Rawls's theory of justice primarily concerns the morality of institutions and secondarily the morality of conduct under them. A central theme of the latter is that ""We are not to gain from the cooperative efforts of others without doing our fair share"" (TJ 96.) This idea, its implications and Rawls's terminology evolve as his theory of justice develops. In 1964 Rawls presented what he then called ""the duty of fair play"" as the ground of a widely applicable ""moral obligation to obey the law"" (CP 117–128), whereas in 1971 ""the principle of fairness"" is said to ground an obligation of obedience to law that applies to only a limited subset of citizens (TJ 308–312). These changes are related to Rawls's distinguishing ""obligations,"" based on fairness and incurred by voluntary actions, from ""natural duties,"" which obtain independently of anyone's voluntary acts (TJ 96).","","","","10.1017/CBO9781139026741.074","https://consensus.app/papers/fairness-principle-of-mandle-reidy/96cd3e8197b253a2a28a7f6ace02bb87/"
"FAIR data management: a framework for fostering data literacy in biomedical sciences education","Integrating FAIR principles into biomedical sciences education enhances research reproducibility and transparency, equipping future researchers with essential skills for navigating a data-driven scientific environment.","Rocio Gonzalez Soltero, Debora Pino García, Alberto Bellido, Pablo Ryan, Ana I. Rodríguez-Learte",2024,0,"Data literacy, the ability to understand and effectively communicate with data, is crucial for researchers to interpret and validate data. However, low reproducibility in biomedical research is nowadays a significant issue, with major implications for scientific progress and the reliability of findings. Recognizing this, funding bodies such as the European Commission emphasize the importance of regular data management practices to enhance reproducibility. Establishing a standardized framework for statistical methods and data analysis is essential to minimize biases and inaccuracies. The FAIR principles (Findable, Accessible, Interoperable, Reusable) aim to enhance data interoperability and reusability, promoting transparent and ethical data practices. The study presented here aimed to train postgraduate students at the Universidad Europea de Madrid in data literacy skills and FAIR principles, assessing their application in master thesis projects. A total of 46 participants, including students and mentors, were involved in the study during the 2022–2023 academic year. Students were trained to prioritize FAIR data sources and implement Data Management Plans (DMPs) during their master's thesis. An 11-item questionnaire was developed to evaluate the FAIRness of research data, showing strong internal consistency. The study found that integrating FAIR principles into educational curricula is crucial for enhancing research reproducibility and transparency. This approach equips future researchers with essential skills for navigating a data-driven scientific environment and contributes to advancing scientific knowledge.","non-rct observational study","BMC Medical Research Methodology","1","10.1186/s12874-024-02404-1","https://consensus.app/papers/fair-data-management-a-framework-for-fostering-data-soltero-ryan/404b16b128665e8eb46f0b037fd449ce/"
